text,label,FOOD_usefulness,FOOD_score,LOCATION_usefulness,LOCATION_score,ATOMSPHERE_usefulness,ATOMSPHERE_score,SERVICE_usefulness,SERVICE_score,PRICE_usefulness,PRICE_score,MENU_usefulness,MENU_score,SPEED_usefulness,SPEED_score
"Hands down our favorite place to get gumbo in the Quarter and we've tried a lot of them. My personal favorite is the chicken-sausage gumbo but we've been down enough for Easter that I cant resits their Traditional Good Friday Gumbo. I've tried other things in the menu (like the Blackened Chicken) but if its your first time here be sure to get the Gumbo! Not too often do I leave room for desert but when I do I'm never disappointed. 
If you have an appetite, try the Complete Creole Dinner, this way you get it all; Gumbo, Étouffée, vegetable and dessert you seriously cant go wrong. 
The walk through the ally to the host's stand is so quintessential New Orleans and the short wait you might expect there only adds to the overall ambience. (Keep in mind there's a reason restaurants can't seat you until your entire party is present.) There is both indoor and outdoor seating available. It's small quaint and sometime crowded but the atmosphere serves well to compliment the you entire dining experience.",2,1.0,5.0,0.98828125,5.0,1.0,5.0,3.3140182e-05,4.09375,1.5688784e-11,4.1875,1.0,4.96875,0.00016021729,2.75
What a great little Café. I had the fried grouper sandwich and she had the buffalo shrimp. The lobster bisque was awesome. Not fancy but just a friendly place with good food,2,1.0,5.0,1.8189894e-12,3.109375,0.03955078,4.1875,5.2619725e-08,3.671875,5.0803806e-13,4.28125,0.91015625,4.4375,5.0590643e-12,2.484375
"Pretty disappointed with my take out order here from Saturday night. I ordered the green curry with brown rice (up charge) - total $15 and when I got home and checked the portion, it was ridiculously small. I've ordered take out from them and have eaten in many times but it was never that small. The rice was literally a couple spoons and the curry had very little chicken and it was much smaller than their lunch special portions. I guess I'll have to check next time I order to go to make sure I'm getting enough.",0,0.80078125,1.578125,1.2789769e-13,4.4375,1.5575097e-11,1.8125,1.7917046e-10,1.84375,0.76953125,1.84375,3.2186508e-05,1.171875,2.4556357e-10,1.6796875
I love this place!!!! Good food. Definitely one of my top favs. Snickerdoodle pancakes are awesome.,2,1.0,5.03125,2.5046631e-13,4.34375,1.9208528e-09,1.6015625,6.217249e-13,4.4375,2.6822988e-13,4.5,0.9921875,4.84375,9.450218e-13,3.171875
"After trying the French 75 at Luke's and immensely enjoying it, we decided we need to stop by the OG institution that served up this New Orleans classic. Walking into the bar you are transported back to the 1940s. The decor and ambiance is awesome although there's quite a bit of undesired cigarette and cigar smoke in the cozy bar area for non-smokers such as ourselves. After trying their French 75, I have to say I came away a bit underwhelmed. I thought Luke's version was better and seemed to drink a lot smoother; perhaps from a lower champagne ratio. We decided to head out to another bar after the 1 drink, so I can't really comment on anything else.",1,2.4914742e-05,2.5625,2.30968e-06,4.84375,0.98828125,4.6875,8.6856744e-11,3.171875,1.8900437e-12,3.03125,0.0012359619,1.8515625,0.00030136108,2.359375
"If your getting a plain black coffee they're great. Otherwise everything is a bit mediocre and okay. I've tried a few things here and everything pretty much tastes the same. They aren't the worst coffee joint, but I'd prefer Starbucks.",1,1.0,2.03125,1.767475e-13,4.5,6.511982e-10,1.6015625,8.9528385e-13,3.859375,3.3573144e-13,4.34375,0.66796875,1.8828125,1.3145041e-12,3.359375
"It is really a shame because the food and coffee are really good. I am a huge fan of the cold mint ice tea, its really yummy, but the wait staff are just to snarky. They look at you like you are bothering them when you ask them for something, and they are extremely rude. Bad service, I will  never go back in there again.",0,1.0,5.0,1.7230661e-13,4.46875,0.0025787354,2.0,1.0,1.0,2.8954616e-13,4.53125,0.9375,4.0625,1.4454126e-06,2.140625
We are from California and went to Mannings after the Giants vs. Saints game. The restaurant was very busy when we arrived. The menu was basic bar food and they told us it would be 2 hours at least. The bar staff were very slow and under staffed. They had 1 game on and told us they didn't have NFL ticket ! Can't believe sporte bar didn't have multiple games on. It was a terrible experience and can't understand how Manning family couldn't provide better services. Very bad ! We went next door to Grand Isle and the food and service was excellent,0,2.9802322e-07,2.3125,0.0045166016,4.96875,0.049316406,1.8984375,1.0,1.078125,1.1226575e-12,4.25,1.0,1.984375,0.99609375,1.515625
"Awesome restaurant! We where in Santa Barbara for a long weekend and we decided we wanted to have Mexican food. Yelp helped us make the decision of where to go. The reviews were spot on. The food was awesome! We came back two days in a row for the ribeye tacos. The restaurant was extremely busy, but have plenty of help to keep things going. Highly suggest to try out this restaurant!",2,1.0,5.0,3.33786e-05,2.75,0.0008773804,2.984375,0.640625,5.0,3.0553338e-13,4.28125,0.10498047,3.71875,0.033447266,4.375
"We had heard that Jimmy Kelly's was a premiere steak house in the south. So we decided to try it for my wife's birthday.

The service was second to none, with out waiter being very affable and friendly. He was extremely helpful in recommendations and was a joy to have around.

We both had a Kansas City 18oz cut cooked Medium Rare. The steak was delicious and made to order. I had the steak fries, and my wife had a baked potato. They brought the potato toppings out separate which was nice, so she could load it however she wanted.

We had made online reservations, and had mentioned it was my wife's birthday, and they brought out a cake (free of charge!) with a candle on it. It made my wife's night. We even shared some with our waiter.

The ambience is great, as the restaurant is a converted mansion. The bathroom was a bit small and dark, and the stall didn't lock, and was extremely cramped.

The steak, as I mentioned was delicious, but I'm not sure it was worth the roughly $37.00 we paid for it. It seemed over priced for what you get.",2,1.0,4.40625,0.002319336,4.875,0.671875,4.9375,1.0,5.0,1.0,1.9453125,0.033203125,3.546875,9.5460564e-08,3.5
Definitely not the best I've had. Neither was Geno's.. it was exciting just to experience an authentic philly cheesesteak.,0,1.0,2.3125,1.1350494e-08,2.84375,1.8328428e-06,1.375,2.9984903e-12,3.0625,3.090861e-13,4.4375,0.0036468506,2.359375,4.456524e-11,2.046875
"Highly upset with my experience. Firstly, when we walked in there was no hello just immediately asked how many. Then when sat at the table no actual server ever greeted us. We were never talked to the whole time we were there and the only time we were was when ordering food. Our water glasses were also never refilled. Then when I get my sushi I ordered a Philly roll and it was just so salty and it didn't taste so well. So when I told a server walking around (because we never knew who ours was) he took away the plate and brought it to the manager. The manager proceeds to take the plate firstly to the wrong table asking them what was wrong with the sushi then realizes that it was the wrong table. Then when he comes up to me he shows me the roll sitting on the plate and asked what was wrong with it. When I told him it was too salty he started making excuses like I was stupid or something. The manager didn't even do anything about this except make excuses and roll his eyes at me which was so not professional. I used to love going here but you can also probably find somewhere better to spend your money.",0,1.0,1.921875,5.471179e-13,4.03125,0.47265625,1.1328125,1.0,1.0,5.4569682e-11,4.03125,0.37890625,1.875,0.016845703,2.25
"This review is only based on their ""Soon to be Famous"" house style wings! I have not tried anything else yet on the menu.

Can I just say that the house style wings was one of the BEST tasting wings I ever had and In my opinion it is the BEST in WESLEY CHAPEL. 

They are grilled not fried so it's not greasy at all. They were marinated overnight so they are very flavorful. Delicious!!! When you can eat the wings without needing any ranch or blue cheese, I call that a WINNER! 

SN: it is more expensive that other wing related restaurants in the area if you compare prices but it's sooooo good!

Other than that, it's located in a ice skating arena. It's not uncomfortably cold in the restaurant. It's a bar type, casual atmosphere and it's overlooking one of the ice rinks in the arena.",2,1.0,5.0,1.0,4.1875,1.0,4.96875,1.330136e-11,3.6875,1.0,2.34375,0.62109375,5.0,7.741619e-09,2.84375
"As a person who recently stopped eating dairy and gluten, a dessert place like this is heaven on earth.  I sampled the oatmeal cookie cream pie as well as a chocolate caramel donut.  They were incredible.  This is my new favorite dessert store!",2,1.0,5.0,2.6467717e-13,4.3125,2.5174813e-09,3.171875,5.8619776e-13,4.4375,3.410605e-13,4.53125,0.9765625,5.0,1.4708235e-12,3.015625
I went here once for brunch and it was pretty good! They have a nice patio with some tables where you can have a relaxing brunch on the weekend. You actually get the option of breakfast or lunch menu or both. I wanted corned beef with poached eggs on an English muffin but they were OUT of corned beef! So I ended up getting the veggie standby which was ok. I definitely plan on going back trying more!,1,1.0,3.25,0.6484375,4.9375,0.33398438,4.78125,0.0012588501,3.015625,5.5422333e-13,4.0625,0.953125,3.984375,8.08388e-07,1.1875
"This place is an un-charming little dump. Rude/slow/bad service, bland food, poor beer selection and overpriced garbage food. I was there on a recent Wednesday. The place was mostly empty, yet it took hours to get anything. Yucky food and way too much attitude from the indifferent servers. Yep, that's a dump. My guess is this place will be out of business soon. Stay away!",0,1.0,1.0,2.1373125e-11,2.171875,0.6875,1.046875,1.0,1.0,0.99609375,1.09375,0.026123047,1.0078125,1.0,1.09375
I have read some of the other reviews and should have read them before trying this place.  Eating should be enjoyable.  I have started eating at Jade Garden at Hillsborough and Habana.  Definitely worth the drive to get some quality Chinese food.,0,0.13964844,5.0,0.08935547,4.875,1.4551915e-10,1.96875,3.922196e-12,3.890625,4.888534e-12,4.5,1.6880222e-09,3.78125,3.0468073e-11,2.375
"NEW CHEF has led to absolutely phenomenal experience!  My hubby and I have been going to the Inn at Phillips Mill for the past 10 years. We live in New Hope, and it has always been our first choice for a solid, romantic, delicious experience. 

Last night, we were WOWED by our entrees. So much so, that I actually asked the waitress if there was a new chef in the kitchen. I had never asked that question before, but every dish was beautifully prepared to perfection. Truly amazing. 

The waitress said, ""Yes, he started last week.""

Well, before word gets out (and trust me it will), run -- don't walk to Phillip's Mill.  This chef is superlative, and the best thing that's come to New Hope in a very long time.

Thank you Inn at Phillips Mill for a wonderful evening!",2,1.0,5.0,0.099121094,4.84375,1.4826655e-06,3.859375,0.05859375,4.96875,2.5579538e-13,4.4375,0.012084961,4.90625,3.074092e-10,2.703125
"Good service, great sushi... There aren't a lot of reasonably priced sushi options in town & I'm glad to see one open! They're also willing to accommodate requests for items not on the menu at no extra charge.",2,1.0,5.0,1.6570091e-05,1.9140625,1.2660166e-09,1.6796875,1.0,5.0,0.6953125,5.0,0.0061950684,4.09375,1.0728836e-05,3.71875
Super disappointed with the service at the new fishtown location. Walked in at lunch time and waited with 3 other groups for about 10 Mins before we decided to leave. The restaurant was not full and there were two workers serving/cleaning up and no one acknowledged the customers who were waiting. It was rude and unprofessional. Heard a lot of great things about green eggs and was so turned off by the service that I will not be going back to this location.,0,1.4352963e-12,4.125,0.0016708374,4.09375,4.5776367e-05,1.0703125,1.0,1.0,2.5757174e-13,4.625,6.0751404e-13,4.21875,0.9296875,1.65625
"I attended a wedding here in their Silos room in Jan 2018. It was a easy location to find which was nice since we were travelling from over an hr away. There was plenty of signage to show you where to go and lots of parking. 

The wedding ceremony in the Silos was very nice and the room was dimly lit and felt very romantic. Everything was available in one central area so guest didn't need to wander around. 

The wedding had a photo booth and a dessert table in each of the silos. If someone didn't tell me to look up, I would've probably missed it. It was pretty neat looking up into a silo. 

I would say that the bathrooms were large but in a weird layout and it was difficult to walk past people washing their hands when you went to find an open stall. 

I'm not sure if the food was catered by the hotel but it was just okay. The chicken was dry and the steak had gravy on it. I guess to prevent it from drying out. The sweet potato was very good.",1,1.0,2.609375,1.0,5.0,0.6796875,4.96875,5.638867e-10,3.171875,2.469136e-13,4.4375,0.77734375,2.296875,1.0404619e-09,1.5703125
Nice little bar/restaurant. They have a tone of stuff on the menu and great daily deals. Service could be better but kind ok with it. It let's you enjoy life and live in the moment. I ordered a nice selection of oysters with all the fixings.,2,0.7890625,4.09375,2.5465852e-11,2.4375,0.31640625,4.59375,1.0,2.984375,0.0058288574,4.375,0.98828125,4.09375,2.6524067e-06,1.2109375
"The food is good. No complaints. The store itself is adorable, and I love all of their pre-made food packaging (is that weird to notice and like it? Salad dressings to-go in cute little weck bottles? Adorable!). 

My only complaint was that they were kinda rude. I'm gluten free, and simply asked if they had any gf options...and then got a brusque and rude-ish response, about how some foods are naturally gluten free (thanks for the update) and that they have GF bread, but that not all sandwiches can be made using that bread (apparently they pre-make all of their panninis--which is interesting to know they aren't made to order). So,  that's fine if you don't have any special menu items, and YES i'm aware that a kale salad doesn't have gluten in it, but no need to snap! 

Anyways, I ended up with a fine egg sandwich with bacon and harissa. Nothing special, but very solid and good...and in the days when I did eat breads, the baked goods from Winslow's home are deeeeelish!",1,1.0,4.0,5.5422333e-12,3.421875,0.068847656,4.96875,1.0,1.6640625,1.2505552e-12,4.09375,0.19042969,3.234375,6.91216e-10,2.890625
"I've been to cafe du monde quite a few times and upon my most current trip to Nola, we tried this place, Cafe Beignet.. it's delicious!  Much better than Du monde.  Not greasy, fluffy and fresh.. I would try it!",2,1.0,5.0,5.424954e-08,1.3515625,1.1568773e-09,1.78125,1.2008172e-12,3.46875,3.1619152e-13,4.4375,0.0012664795,4.90625,4.4110493e-11,2.03125
"I had a hankering for good Mexican food and found this spot on Yelp.  It is located right down the street from UofA.  The wait was painfully long to order.  There was only one guy running the entire place, and one cook.  We finally ordered about 10 minutes later.  It is one of those places where you order at the counter and then they bring the food out to you, but more upscale than fast casual.  We ordered some tacos, Boca Balls, beans, and the Chips and Salsa.  We sat and waited and waited.  About 15 minutes later we got the chips and salsa. The server described each salsa in detail and then went back inside. 

OK SO HERE IS THE DEAL......
Best fuc*ing chips and salsa in my fuck*ng life.  Banana Habanero whaaaa?! Roasted Tomato. ...Pineapple Salsa, Cactus with Orzo. Pair these salsas with freshly fried chips with some amazing salt. ...heaven.  I did not even mind the wait. Our meal came out shortly after.  Again, the server described in detail what was on the plate.  It was just beautiful.  And delicious.  My friend said it was the best fish taco he had ever had.  And we live in L.A. so that is a bold statement.  Fu*k it was good. I can't stop dropping the F-bomb because it was so good. 
Boca Balls? Best balls that have ever been in my mouth.  And there have been quite a few knowwhatimsayin?!

Will you wait a long time? YES
Will it be worth it? 100 times YES",2,1.0,5.0,1.0,4.03125,1.0,1.5234375,1.0,4.03125,3.2159733e-09,2.234375,1.0,4.96875,1.0,3.40625
Really good pizza great for a solo lunch or takeout for the family plus they have those cool combine flavor soda machines so you can get creative with your drink only downside is often times there's a bit of a language barrier it seems so I normally phone in my order because the best English speaker takes the phones,2,0.69140625,4.625,4.0233135e-06,2.8125,0.05859375,3.40625,0.98046875,3.203125,8.440111e-09,3.578125,0.053710938,3.78125,0.15039062,3.578125
"My feeling for the restaurant is mixed. We ordered seared foie gras and abalone and share a berry cheesecake. The foie was excellent but the crepe accompanying the foie was a bit too sweet with cinnamon that was a bit over powering. The abalone was sweet, tender and fresh. Excellent, however the pasta was over cook, too creamy and a bit too lemony and creamy and do not compliment the abalone at all. Berry cheesecake was really good. However overall For $88 without drink, the excitement on the foie and abalone which stand out by itself just being fresh ingredient. There is no culinary spin and creativity that bring it up a notch that I am a bit disappointed.",1,1.0,4.0,1.10134124e-13,4.3125,2.5494955e-08,2.4375,1.0089707e-12,3.5625,0.984375,1.984375,0.984375,3.890625,4.7439244e-09,1.421875
"This bucket list item is finally checked off, and was totally worth it! The beignets are little clouds from the heavens. And they just pack on the powdered sugar. 

The table service was slow, so we just stood in line and got our beignets to go!",2,1.0,5.03125,5.7298166e-11,2.9375,9.679794e-05,3.71875,1.0,2.046875,4.725109e-13,4.375,0.87890625,4.96875,0.9765625,3.90625
"It's a great place if you want authentic Thai food without much of a fine dining experience.  Service is of supreme level in its own way. I said in its own way because Chef/owner sings off key , make jokes and the waitress is too humble and welcoming.

Flavor of food might be little different from other Thai restaurants because as I said it's more authentic and recipes are not modified to suit taste of most of the local people. But if you want to taste real Thai or just want to try something new then this place deserves your visit. 
Thai hot is just medium for me but you can ask for spice tray and add more heat.

It's simple quite ,relatively small restaurant with plenty of parking.",2,1.0,4.75,0.09033203,4.1875,0.44335938,4.59375,1.0,5.03125,1.8644641e-11,3.53125,0.63671875,4.34375,5.811453e-07,2.296875
"Delicious. I am an out of towner coming here for the 2nd time. We have been to great Cuban restaurants in many cities including living in So Fla for 17 years.  This is a quality place with HUGE portions, very nice servers. Couldn't recommend more highly!!",2,1.0,5.0,1.3387762e-09,1.5,3.0994415e-06,2.5625,1.0,5.0,3.808509e-12,4.25,0.0234375,3.671875,8.583356e-12,3.046875
"Recommended by the hotel I was staying that was near by. The atmosphere is cool because you get to see the planes coming in and out from a balcony view. 

The menu was rather limited in my opinion. I came for dinner but this place seems to be bigger for breakfast and lunch. I had the steak, potatoes and Parmesan tomato. It was good but nothing special. I was surprised as to how long everything took to make and to be served seeing as I was one of the only people there. 

Probably a place to try once and that's it.",0,1.0,2.921875,0.87109375,5.0,1.0,5.0,0.703125,2.359375,1.41398e-12,3.5,1.0,2.015625,1.0,1.984375
"Although Bodega looks like a small, hole in the wall, it's actually a very clean and quaint little restaurant with terrific food.",2,1.0,5.0,1.7229468e-07,1.4609375,0.3515625,4.5625,4.1922021e-13,4.4375,3.0198066e-13,4.5,1.9099389e-10,2.375,2.9487524e-13,4.15625
"Wow!! Very Covid Safe! Thank you for opening this amazing restaurant. The service, food, decor and ambiance exceeded every expectation. It was a fantastic experience all the way through. This is locally owned not a chain, staff is 5 Star trained. The recipes for the meats is better than Texas de Brazil!  The pork ribs are the best ribs I've ever had. I'm a former MGM VP of Casino Marketing I've eaten at the best restaurants in the world. This service is the BEST I've ever had since moving to Reno. The staff makes you feel like this has been your spot for years. The owner touches a the tables and helps serve.",2,1.0,5.0,8.458301e-11,1.875,0.08496094,5.0,1.0,5.0,3.659295e-13,4.34375,0.10449219,4.15625,3.4779077e-09,1.71875
Caleb's continues to be excellent... Never an average or bad meal... Always to notch service and taste.. at a good value as well.. highly recommend!!!,2,1.0,5.0,3.126388e-13,4.4375,1.4210855e-11,3.578125,1.0,5.0,0.9140625,4.8125,1.0251999e-05,3.546875,8.81073e-12,3.578125
"Beyond compare delicious. The parents are in the kitchen, the son works the front. Talk about home cooking. Best chicken kabob, hummus, baba. Also don't miss the mujarda-lentils, rice, topped with crispy onions. BYOB is a plus.",2,1.0,5.0,5.3432814e-12,2.6875,0.0003490448,2.859375,4.4237822e-09,2.875,2.1032065e-12,4.28125,1.0,5.0,2.16005e-12,3.078125
"Price was decent for the size of the slices. I ordered a slice of supreme and a few other items. It took at least 45 minutes before we got our order. There were a few people behind us that got theirs before ours. So for that amount of time, I thought they were making the slices from scratch...wrong. The supreme had a lot of meat on it. The olives and onions lacked the crunch I was looking for in a supreme pizza. Pretty certain they have been sitting out and just reheated. Crust was ok. They gave me breadsticks instead of mozzarella sticks. So all in all, not worth the hype that I've heard from some of my coworkers.",0,1.0,2.0,1.3677948e-13,4.3125,2.7418137e-05,1.25,0.9921875,1.8984375,0.98828125,3.96875,0.30664062,2.71875,1.0,1.4921875
I walked in to get a djambe (spelling) drum for my husband for Christmas. I dont know much about them but wally was there happy and willing to help. He helped me pick out the perfect instrument and offered it hold it for me until christmas as well as offered to find a box so I could wrap it. I also asked about flute repairs since mine is in need of some maintenance and he was happy to walk me through the pricing guide of that as well. I was super pleased with the excellent customer service and look forward to working with this company in the future.,2,2.5224267e-13,4.40625,3.1441516e-13,4.15625,5.9604645e-07,2.8125,1.0,5.0,8.697043e-12,3.578125,1.8829382e-13,4.0625,2.6077032e-07,2.265625
Loved the valet parking. We had a 7:15 reservation for 3 and were seated at 7:45; we were offered a free appetizer or drink which we accepted. The crab cakes were overwhelmed with smoke and the mushrooms for the fondue were crispy and delish but the fondue seemed to be blue cheese dressing...with heavily smoked bacon and scallions and MayTag blue cheese. Steaks all around and they were super tender BUT again were over smoked...you could not clear your palate of the smoke. Service was okay...twice we had to ask for another wine and twice for another steak knife. They ran out of creamed spinach at 8:30 PM and it was unclear why they could not make more since they were still seating people at 10 PM.. Au Gratin potatoes were good as were the mushrooms/onions. Best part for me was the wedge salad and $7 was a reasonable price. Would I return...due to the pervasive smokiness of the food I would not but it was worth a try.,0,1.0,2.796875,3.6743586e-10,3.90625,0.00030899048,3.4375,1.0,2.921875,1.0,5.0,0.28710938,3.4375,0.25,2.875
"Classic diner with fairly predictable breakfast menu. If you're looking for a quick breakfast with no frills, this is a good fit (and I don't mean that in a bad way!) My boyfriend and I went on a Sunday morning in the summer so not too crowded. He got the traditional diner breakfast (eggs, potatoes and toast) and I had the avocado toast with add ons of an egg, tomato and bacon. See photo attached. We also split a pancake! Portion sizes were good and the food was fine. Nothing fancy but fresh and filling. Service was also quick and attentive. I would return for lunch or for a quick and simple breakfast again...although since the prices are consistent with other brunch spots in town and quality was just OK, it won't be our go to",1,1.0,3.015625,6.2864274e-08,2.15625,0.0056152344,3.328125,1.0,5.0,0.99609375,3.0,0.953125,2.96875,1.0,5.0
"Very bad service. I ordered buffalo chicken wings and turkey sandwich. I didn't check my bag, after I sit in the airplane, I found out there is only the sandwich and one box chips.  No chicken wings. I paid more that $12 for chicken wings.",0,0.0018692017,2.140625,7.1409545e-13,3.71875,1.010485e-07,1.09375,1.0,1.0,0.984375,1.953125,0.004211426,2.0625,0.12060547,1.5703125
